{
  "skill_id": "SKILL-VT-001",
  "name": "view_file",
  "purpose": "Read file contents from the local filesystem.",
  "inputs": [
    {
      "name": "AbsolutePath",
      "type": "string"
    },
    {
      "name": "StartLine",
      "type": "integer"
    },
    {
      "name": "EndLine",
      "type": "integer"
    }
  ],
  "outputs": [
    {
      "name": "content",
      "type": "string"
    }
  ],
  "boundaries": [
    "Only access files inside the Vibe Tracing project workspace"
  ],
  "constraints": [
    "must not override factual evidence fields"
  ]
}
